Title,Creator,Description,Subject,Source,Publisher,Thumbnail,Link
Rhetorical Advocacy and the Scholarship of Application,"Juergensmeyer, Erik","This article argues for an expanded understanding of academic labor as it aligns with Ernest Boyer’s concepts of the scholarship of engagement and the scholarship of application. It draws on theories of rhetorical advocacy and rhetorical ecologies in order to help academics participate more in their communities. It concludes by applying these concepts to a community advocacy project, demonstrating the importance of connecting scholarship and public work.",,DigitalCommons,Cal Poly Humboldt,https://img.icons8.com/color/96/document.png,https://digitalcommons.humboldt.edu/alra/vol1/iss1/7
“It’s Not as Rosy as I’d Like It to Be” A Literacy-and-Identity Case Study of a Contingent Academic (Not) Writing for Publication,"Vacek, Kathleen","For academics hovering between contingent and permanent status, getting publications on the CV can make the difference—or can it? Looking closely at engagement with professional academic literacy practices offers meaningful insights into academic labor. This article considers the case of a newly-minted PhD working a collection of contingent jobs while aspiring to publish and obtain a permanent position. In the face of a heavy teaching load and disheartening job search, Elle Stewart (a pseudonym), decides to put off writing. She disidentifies with the discourse of being an academic and disengages from professional academic literacy practices, despite a life history full of success with academic writing. This case study takes an academic literacies approach and uses a framework of discoursally constructed writer identity to consider how Elle’s literacies and identities mediate one another. While personalizing many of the dilemmas of contingent labor, the case study also considers Elle’s painful disconnection from research and the structural factors that lead her to feel shut out of professional academic writing.",,DigitalCommons,Cal Poly Humboldt,https://img.icons8.com/color/96/document.png,https://digitalcommons.humboldt.edu/alra/vol1/iss1/5
Don't Rock the Boat Curricular Choices of Contingent and Permanent Composition Faculty,"Lynch-Biniek, Amy",,English studies ; composition ; contingency studies ; Rhetoric and Composition ; curricular choice,DigitalCommons,Cal Poly Humboldt,https://img.icons8.com/color/96/document.png,https://digitalcommons.humboldt.edu/alra/vol1/iss1/4
Contingency in Higher Education  Evidence and Explanation,"Shulman, Steven","This paper summarizes recent evidence on the trends in contingency in higher education. Contingent faculty employment, defined as the sum of full-time non-tenure track faculty employment and part-time faculty employment, increased both absolutely and relative to all faculty positions between 2002 and 2015, despite a modest downturn after 2011. The long-term growth of contingency since 2002 has primarily occurred in doctoral degree universities. The short-term decline in contingency since 2011 has primarily occurred in public associates’ degree colleges and in private for-profit colleges. The short-term decline in contingency since 2011 is due to the contraction of the for-profit sector combined with a one-time drop in public associates’ degree colleges. The explanation of the long-term growth of contingency as an inevitable response to financial exigency is rejected. Contingency has increased due to the priorities of higher education administrators, not state budget cuts or other drops in revenue.",adjunct faculty ; higher education ; Contingent faculty ; Labor Economics ; academic labor markets,DigitalCommons,Cal Poly Humboldt,https://img.icons8.com/color/96/document.png,https://digitalcommons.humboldt.edu/alra/vol1/iss1/3
Saying Goodbye to Unions in Higher Education The Yale Hunger Strike in Perspective,"Hogler, Raymond L",,labor unions ; Business Administration ; Management ; Labor and Employment Law ; Collective Bargaining ; national labor relations board ; supreme court decisions ; and Operations ; collective bargaining ; academia ; right to work ; Labor Relations ; Unions,DigitalCommons,Cal Poly Humboldt,https://img.icons8.com/color/96/document.png,https://digitalcommons.humboldt.edu/alra/vol1/iss1/6
"The Praxis of Deceleration Recovery as ""Inner Work, Public Act""","Cortez, Marisol, Ph.D.","Originally published in Deceleration and presented at the 2017 meeting of the Association for the Study of Literature and the Environment, this short essay details the vision and praxis behind an online journal of environmental justice co-edited by the author alongside environmental journalist Gregory Harman. In this essay, I situate the evolution of this project in relation to our precarious institutional positions as writers with disabilities who consequently work in the spaces between academia, journalism, activism, and creative writing. This positionality has in turn placed Deceleration in conversation with degrowth and allied movements around the world, which challenge the disabling productivism that regulates the temporal rhythms of not only academia and everyday life but also our modes of activist resistance. Inspired by these challenges, Deceleration envisions new ways of responding to environmental and political crises, grounding writing, thinking, and acting in a reinhabitation of biological time.",environmental justice ; Other Arts and Humanities ; independent scholarship ; disability ; degrowth ; care ; Environmental Studies,DigitalCommons,Cal Poly Humboldt,https://img.icons8.com/color/96/document.png,https://digitalcommons.humboldt.edu/alra/vol2/iss1/7
From the Editors,Editors of ALRA,,,DigitalCommons,Cal Poly Humboldt,https://img.icons8.com/color/96/document.png,https://digitalcommons.humboldt.edu/alra/vol1/iss1/2
"Volume 1, Issue 1",Center for the Study of Academic Labor,,,DigitalCommons,Cal Poly Humboldt,https://img.icons8.com/color/96/document.png,https://digitalcommons.humboldt.edu/alra/vol1/iss1/1
Rhetorical Listening and Strategic Contemplation as Research Tools Learning from Edwin Hopkins and Early Attempts at Labor Reform in Composition,"Gerdes-McClain, Rebecca","This paper is a personal and historical study of the labor conditions of composition teachers, in which I present the work of Edwin Hopkins, a professor at the University of Kansas from 1889 to 1937, who collected data on composition teaching between 1909 and 1915 in an attempt to reform the labor conditions of composition teachers. The paper is necessarily personal because I employ rhetorical listening, developed by Krista Ratcliffe, and strategic contemplation, developed by Jaqueline Jones Royster and Gesa Kirsch, as research methods for engaging with historical and archival research. Both of these methods require careful analysis of my personal interests in and motivations for this research. This analysis of my personal interests and motivation takes two forms: (1) narrative vignettes of my own labor experiences, which I use to facilitate rhetorical listening, and (2) descriptive analyses of my reactions to my research, which document how strategic contemplation was enacted through my reflective practices. The reader should therefore be prepared for the paper to alternate between readings of Hopkins’ work and reflections on my own teaching and research. Using rhetorical listening and strategic contemplation, I evaluate Hopkins’ strategies for reforming labor conditions in the early twentieth century and what they offer compositionists interested in reforming our current labor conditions. I focus particularly on Hopkins’ attempts to persuade those outside the composition classroom that labor conditions in those classrooms were untenable and directly related the “problem” of unsatisfactory student writing, looking for resonances—my term for connections and similarities—between attempts to reform modern labor issues in the composition classroom and Hopkins’ strategies. Ultimately I argue that attempts at labor reform need to consider historical case studies, like Hopkins', when strategizing ways to improve the teaching conditions of writing instructors. Too often, attempts to improve labor conditions surrounding the teaching of writing ignore the rich and complex labor history of our field.",Composition Labor History ; Rhetoric and Composition ; Feminist Rhetorical Practices,DigitalCommons,Cal Poly Humboldt,https://img.icons8.com/color/96/document.png,https://digitalcommons.humboldt.edu/alra/vol2/iss1/4
FAST Professor Strategies for Surviving the Tenure Track,"Droz, Patricia Welsh ; Jacobs, Lorie Stagg","In response to Maggie Berg and Barbara Seeber’s 2016 manifesto on academic deceleration, The Slow Professor, the present article posits that the slow approach is dangerous for those seeking tenure, but is nevertheless a fruitful resistance philosophy to be adopted once tenure is achieved. For those seeking tenure, we advise an alternative philosophy, FAST professing, as a means to mediate workplace stress and offer to those on the tenure-track a pragmatic alternative to premature slow professing. We outline the nature of the stress in today’s academic climate, suggest identifying the major sources of stress, and finally, offer strategies to streamline the workday and maintain life work balance en route to tenure.",tenure survival ; slow professor ; tenure-track ; Rhetoric and Composition ; professorship ; strategies for success ; academy ; workplace stress,DigitalCommons,Cal Poly Humboldt,https://img.icons8.com/color/96/document.png,https://digitalcommons.humboldt.edu/alra/vol2/iss1/6
Terms of Time for Composition A Materialist Examination of Contingent Faculty Labor,"Priest, Jesse","Bruce Horner’s seminal book, Terms of Work for Composition: A Materialist Critique provided Comp-Rhet WPAs with a methodology for infusing our conversations about work and labor with a holistic understanding of how these reflect on the lived experiences of students, teachers and administrators. Drawing on empirical data including surveys of contingent faculty at a large northeastern research university, as well as textual analysis of teaching material and an NCTE position statement, I propose the inclusion of a materialist-oriented conceptualization of time to the discussion began by Horner and others. Using the lens of how time is allocated, I argue for a wider understanding of the separations between how institutions and contingent teaching faculty (including graduate teaching assistants) view the importance of their labor, and discuss implications for curricular and departmental design.",Evaluation ; contingent faculty ; and Research ; composition ; Rhetoric and Composition ; administration ; labor ; Educational Assessment ; Higher Education Administration,DigitalCommons,Cal Poly Humboldt,https://img.icons8.com/color/96/document.png,https://digitalcommons.humboldt.edu/alra/vol2/iss1/5
Instructor Impermanence and the Need for Community College Adjunct Faculty Reform in Colorado,"Mumme, Stephen P","This policy letter, prepared for the Colorado State Board of Community Colleges and Occupational Education and submitted in January 2018 reports on the occupational conditions of adjunct faculty in the Colorado Community College System. The document describes the adverse employment and instructional conditions present in the CCCS, arguing that current conditions threaten the quality and integrity of the General Transfer Pathways program (GT-Pathways) in Colorado. The letter advances a range of practical policy reforms for the consideration of Board that, if adopted would improve current working conditions for adjunct faculty and strengthen quality of community college instruction in Colorado.",adjunct instructors ; Community College Leadership ; Higher Education ; policy reform ; Colorado community colleges,DigitalCommons,Cal Poly Humboldt,https://img.icons8.com/color/96/document.png,https://digitalcommons.humboldt.edu/alra/vol2/iss1/9
Precarious Academic Labor in Germany Termed Contracts and New Berufsverbot,"Gallas, Alexander","The authors examines how precarity is produced in German academia and explores how labour activists are trying to combat it. The focus is on mid-level faculty. In the first part, the mechanics of precarisation are explained; in the second part, the institutional supports of the status quo blocking change in favour of labour are identified, and in the third part, the demands and strategies of two organisations are analyzed that have made headlines in recent years by exposing the proliferation of precarity in German academia: the Education and Science Workers’ Union (GEW) and the Network for Decent Work in Academia (NGAWiss).",Germany ; Economy and Organizations ; Academic labour ; trade unions ; Sociology ; Work ; precarity,DigitalCommons,Cal Poly Humboldt,https://img.icons8.com/color/96/document.png,https://digitalcommons.humboldt.edu/alra/vol2/iss1/8
"""Collegiality as a Dirty Word? Implementing Collegiality Policies in Institutions of Higher Education""","Wooten, Courtney Adams ; Condis, Megan A","Abstract: Collegiality is integral to the healthy functioning of any academic department and is a necessary professional attribute for new faculty, who often spent their graduate school careers with relatively little involvement in institutional politics, to develop. However, the recent trend to explicitly outline tenure and promotion requirements for collegial behavior gives us pause. We question if a collegiality statement for tenure and promotion could function as yet another obstacle between faculty from background that have historically been underrepresented in the academy (women, people of color, LGBTQ individuals, people with disabilities, etcetera) and their bids for tenure.",Gender ; Feminist ; collegiality ; and Sexuality Studies ; Ethnicity and Post-Colonial Studies ; Rhetoric and Composition ; Technical and Professional Writing ; discrimination ; tenure and promotion ; labor ; Disability and Equity in Education ; academia ; Race,DigitalCommons,Cal Poly Humboldt,https://img.icons8.com/color/96/document.png,https://digitalcommons.humboldt.edu/alra/vol2/iss1/3
Reviews of Daniel Davis's Contingent Academic Labor and Lisa del Rosso's Confessions of an Accidental Professor,"Brown, William Christopher",This review covers Daniel Davis's Contingent Academic Labor: Evaluating Conditions to Improve Student Outcomes and Lisa del Rosso's Confessions of an Accidental Professor. Davis's book offers a rubric for evaluating the working conditions of contingent academic laborers. del Rosso's Confessions is a memoir of her experience as a contingent academic laborer.,Evaluation ; Curriculum and Instruction ; contingent academic labor ; and Research ; Scholarship of Teaching and Learning ; adjuncts' working conditions ; Educational Assessment,DigitalCommons,Cal Poly Humboldt,https://img.icons8.com/color/96/document.png,https://digitalcommons.humboldt.edu/alra/vol2/iss1/13
"Academic Collective Bargaining Status, Process, and Prospects","Julius, Daniel J. ; DiGiovanni, Nicholas, Jr.","The authors provide a perspective, as scholars and practitioners, of the organizational, demographic, legal and contextual variables that inform the past and the future of faculty unions in U.S. colleges and universities. They ask, how best to conceptualize and evaluate the impact of faculty unions; from the inception of academic unionization in the 1960’s to the present, and further, what is known and not known about collective bargaining. Issues examined include: factors that influence negotiation processes, governance, bargaining dynamics, the institutional and demographic factors associated with faculties who vote in unions, compensation and the legal status of graduate student unions. Collective bargaining with faculty is viewed through a wider lens of “craft unionism” as it is known in the industrial labor relations context. An effort is made to review contemporary subjects and challenges engaging the parties during negotiations in the second decade of this century. The paper offers an analysis of the impact of collective bargaining on changes in decision making processes and forums, and offers insight into the kinds of management strategies most effective in organized environments. Last, the authors ask what is new about negotiations and what has remained the same over the past 45 years.",Collective Bargaining ; Education ; Higher Education ; Labor Relations ; Unions,DigitalCommons,Cal Poly Humboldt,https://img.icons8.com/color/96/document.png,https://digitalcommons.humboldt.edu/alra/vol3/iss1/11
Neoliberal Higher Education Background of the Pennsylvania State College and University Faculty Strike of 2016,"Mantler, Gordon ; Riedner, Rachel",,,DigitalCommons,Cal Poly Humboldt,https://img.icons8.com/color/96/document.png,https://digitalcommons.humboldt.edu/alra/vol2/iss1/14
Response #3 to AAUP Statement,"Lindblom, Ken",,,DigitalCommons,Cal Poly Humboldt,https://img.icons8.com/color/96/document.png,https://digitalcommons.humboldt.edu/alra/vol2/iss1/12
From the Editors,"Academic Labor: Research and Artistry, Editors of ALRA",,,DigitalCommons,Cal Poly Humboldt,https://img.icons8.com/color/96/document.png,https://digitalcommons.humboldt.edu/alra/vol2/iss1/2
"Volume 2, Issue 1","CSAL, Center for the Study of Academic Labor",,,DigitalCommons,Cal Poly Humboldt,https://img.icons8.com/color/96/document.png,https://digitalcommons.humboldt.edu/alra/vol2/iss1/1
Response #1 to AAUP Statement,"McCallin, Nancy",,,DigitalCommons,Cal Poly Humboldt,https://img.icons8.com/color/96/document.png,https://digitalcommons.humboldt.edu/alra/vol2/iss1/10
Response #2 to AAUP Statement,"Wiegard, Anne",,,DigitalCommons,Cal Poly Humboldt,https://img.icons8.com/color/96/document.png,https://digitalcommons.humboldt.edu/alra/vol2/iss1/11
(Mis)Alignments Between Institutional Mission Statements and Service Learning Handbooks,"Iglesias, Charisse S","Institutions self-identifying as social justice advocates are expected to perform social justice roles through their disciplines, policies, and actions (Feldman, 2008). Applying Tania Mitchell’s critical service learning framework (2008), this study examines (mis)alignments between service learning handbooks and their respective institutional mission statements. The first phase was a critical discourse analysis of the service learning handbooks to measure expressions of reciprocity. The second phase was a content analysis of the corresponding institutional mission statements to analyze conceptions of community engagement, social justice, etc. Findings reveal how institutions frame handbooks, considers how that framing undermines reciprocity, and analyzes how universities practice what they preach by evaluating perception and performance. Readers can expect to question how to conduct ethical community work without universities modeling ethical behavior.",Curriculum design ; Institutional support ; Service learning labor ; Rhetoric ; Other Rhetoric and Composition ; Curriculum and Social Inquiry,DigitalCommons,Cal Poly Humboldt,https://img.icons8.com/color/96/document.png,https://digitalcommons.humboldt.edu/alra/vol3/iss1/7
Snapshots of #WPALife Invisible Labor and Writing Program Administration,"McIntyre, Megan","Writing program administration work is a significant reality for many within the field of rhetoric and composition, and though such work has long been part of our disciplinary fabric, it often remains invisible to departments and institutions. In this article, I offer two brief snapshots of how writing program administration work is often obscured by seemingly brief documents or interactions, which elide the complex communicative and political work at the heart of program administration. I then offer a hashtag-based Twitter community, #WPALife, as one potential way of making this work more visible and of building the capacity to create more just, equitable, and anti-racist writing programs. Visibility can’t be an end in and of itself; rather, making this work visible allows me to be a more effective advocate for equitable and anti-racist practices in my program, institution, university system, and discipline.",Twitter ; writing program administration ; invisible labor ; Other Rhetoric and Composition ; digital community,DigitalCommons,Cal Poly Humboldt,https://img.icons8.com/color/96/document.png,https://digitalcommons.humboldt.edu/alra/vol3/iss1/8
Sustaining Community-Engaged Projects Making Visible the Invisible Labor of Composition Faculty,"Corey, Jessica Rose ; George, Barbara","Increasingly, service-learning, community-engaged projects, or community-engaged learning are encouraged in higher education as part of HIPs, or High Impact Practices. While the authors' experiences with service-learning or community-engaged learning in our composition courses have been positive, and while student engagement is generally acknowledged as a desirable outcome of any pedagogy, we posit that there are questions about the labor system needed to sustain such practices. We use narratives to reflect upon our experiences holding various identity positions within academia (from graduate student, adjunct, to NTT and TT positions), and research about the work involved with community engaged projects, to interrogate the invisible labor of such projects within composition. By making these labor practices explicit, we can theorize and, just as importantly, practice more equitable and sustainable community-engaged projects in composition.",community-engaged projects ; faculty labor ; composition ; high impact learning practices ; service-learning ; labor ; Higher Education ; community engagement,DigitalCommons,Cal Poly Humboldt,https://img.icons8.com/color/96/document.png,https://digitalcommons.humboldt.edu/alra/vol3/iss1/6
Honor the Precariat,"Barnes, Natalie","Honor the Precariat is an art installation conceived and executed to acknowledge and honor the significant contributions of non-tenure track faculty, particularly those colleagues teaching at Colorado State University. The exhibition and accompanying article recognize faculty who work in anonymity and often without security, teaching, advising, and mentoring hundreds of students and representing millions of dollars in tuition revenue.
The essence of the artwork captures the 20+ year struggle of the artist to come to terms with the value of a career in which she has been viewed as a second-class faculty member – and this dichotomy facing all members of what has become new faculty majority. This artwork intends to recognize the value of the artist’s own work and that of other highly treasured colleagues.
Elements of the installation were constructed from published employment and anecdotal data envisioned in a graphic, visual format.",installation ; non-tenure track ; Adjunct ; Art and Design ; precariat ; art ; Arts and Humanities ; Fine Arts,DigitalCommons,Cal Poly Humboldt,https://img.icons8.com/color/96/document.png,https://digitalcommons.humboldt.edu/alra/vol3/iss1/3
Review  Natalie Selden Barnes's Honor the Precariat,"Krieg, Annah","This review details the fall 2017 exhibition of Natalie Selden Barnes's installation, Honor the Precariat, which took place in the Directions Gallery in the Department of Art and Art History at Colorado State University. By combining data with plexiglass figures in an immersive artwork, Selden Barnes compels the viewer to engage with the complex reality of the majority of university educators, those who are adjunct instructors.",installation ; and Archaeology ; Museum Studies ; review ; Architecture ; History of Art ; adjunct ; Art and Design ; art ; margin,DigitalCommons,Cal Poly Humboldt,https://img.icons8.com/color/96/document.png,https://digitalcommons.humboldt.edu/alra/vol3/iss1/4
‘Care Work’ and University Scapegoating  Making Social Reproduction Visible in the Teaching of Writing,"O'Donnell, Rachel T",,Social and Behavioral Sciences ; Education ; social reproduction ; care work ; writing instruction,DigitalCommons,Cal Poly Humboldt,https://img.icons8.com/color/96/document.png,https://digitalcommons.humboldt.edu/alra/vol3/iss1/5
Instructional Spending Per Student  Patterns and Explanations,"Shulman, Steven","Most students know what they spend on tuition and other costs of attending college, but most do not know how much their colleges spend on their education in return. This paper provides figures on instructional spending per full-time equivalent student, broken down by institutional level and sector. Variations in this measure of educational spending can be substantial even among apparently similar institutions. A cross-sectional multiple regression model utilizing 2016 IPEDS data on every public and private non-profit college and university in the United States is used to explore the possible causes of these variations. It shows that instructional spending per student rises with the portion of the budget devoted to instruction. It falls with the non-tenure track portion of the instructional staff, with the prevalence of students from low-income backgrounds, and with tuition as a fraction of total revenue. These findings are mostly as expected, but most of the variation in instructional spending per student is still unexplained.",Economics,DigitalCommons,Cal Poly Humboldt,https://img.icons8.com/color/96/document.png,https://digitalcommons.humboldt.edu/alra/vol3/iss1/12
